{
  "$id": "https://agent-hooks.responsibleai.dev/v0.1/conformance/vectors.schema.json",
  "$schema": "https://json-schema.org/draft/2020-12/schema",
  "title": "Agent Hooks \u2014 CTK vector",
  "description": "Language-agnostic conformance test case (AGENT-HOOKS-0.1 \u00a713.2).",
  "type": "object",
  "additionalProperties": false,
  "required": [
    "id",
    "title",
    "spec_clause",
    "scenario",
    "expect"
  ],
  "properties": {
    "id": {
      "type": "string",
      "pattern": "^AH-CTK-[0-9]{3}(-[a-z0-9-]+)?$"
    },
    "title": {
      "type": "string"
    },
    "spec_clause": {
      "type": "string",
      "description": "Section of AGENT-HOOKS-0.1 this vector verifies."
    },
    "mode": {
      "type": "string",
      "enum": [
        "enforce",
        "evaluate_only"
      ],
      "default": "enforce",
      "description": "Enforcement mode the harness MUST set for this run (\u00a78)."
    },
    "capabilities": {
      "type": "array",
      "items": {
        "type": "string",
        "enum": [
          "model_calls",
          "tool_calls",
          "parallel_tool_calls",
          "streaming",
          "multi_turn"
        ]
      },
      "default": []
    },
    "scenario": {
      "$ref": "#/$defs/scenario"
    },
    "interceptor_script": {
      "type": "array",
      "items": {
        "$ref": "#/$defs/interceptor_rule"
      }
    },
    "approval_script": {
      "type": "array",
      "items": {
        "$ref": "#/$defs/approval_rule"
      },
      "default": []
    },
    "expect": {
      "$ref": "#/$defs/expect"
    },
    "interceptor_scripts": {
      "type": "array",
      "items": {
        "type": "array",
        "items": {
          "$ref": "#/$defs/interceptor_rule"
        }
      },
      "description": "Multi-interceptor form (\u00a77.1 fold-through): one rule list per registered interceptor, in registration order. Mutually exclusive with interceptor_script. An empty array registers zero interceptors."
    }
  },
  "$defs": {
    "scenario": {
      "type": "object",
      "additionalProperties": false,
      "required": [
        "input"
      ],
      "properties": {
        "input": {
          "type": "object",
          "required": [
            "content",
            "role"
          ],
          "properties": {
            "content": true,
            "role": {
              "type": "string",
              "enum": [
                "user",
                "system",
                "external"
              ]
            }
          }
        },
        "tools": {
          "type": "array",
          "items": {
            "type": "object",
            "required": [
              "name",
              "behavior"
            ],
            "properties": {
              "name": {
                "type": "string"
              },
              "schema": {
                "type": "object"
              },
              "behavior": {
                "type": "array",
                "items": {
                  "type": "object",
                  "required": [
                    "return"
                  ],
                  "properties": {
                    "when_args": {
                      "type": "object"
                    },
                    "return": true,
                    "is_error": {
                      "type": "boolean",
                      "default": false
                    }
                  }
                }
              }
            }
          },
          "default": []
        },
        "model_script": {
          "type": "array",
          "items": {
            "type": "object",
            "required": [
              "respond"
            ],
            "properties": {
              "respond": {
                "type": "object",
                "required": [
                  "content",
                  "tool_calls",
                  "finish_reason"
                ],
                "properties": {
                  "content": true,
                  "tool_calls": {
                    "type": "array",
                    "items": {
                      "type": "object",
                      "required": [
                        "id",
                        "name",
                        "args"
                      ],
                      "properties": {
                        "id": {
                          "type": "string"
                        },
                        "name": {
                          "type": "string"
                        },
                        "args": {
                          "type": "object"
                        }
                      }
                    }
                  },
                  "finish_reason": {
                    "type": "string"
                  }
                }
              }
            }
          },
          "default": []
        }
      }
    },
    "interceptor_rule": {
      "type": "object",
      "additionalProperties": false,
      "required": [
        "at"
      ],
      "properties": {
        "at": {
          "$ref": "https://agent-hooks.responsibleai.dev/v0.1/interception-point.schema.json"
        },
        "match": {
          "type": "object",
          "additionalProperties": true,
          "description": "Dotted-path -> expected-value predicates against the AgentContext. All must match."
        },
        "return": {
          "$ref": "https://agent-hooks.responsibleai.dev/v0.1/verdict.schema.json"
        },
        "fault": {
          "type": "string",
          "enum": [
            "raise",
            "malformed_verdict"
          ],
          "description": "Fault injection (NOW-10): 'raise' makes the scripted interceptor raise/throw natively (exercises \u00a76.3 host_error:interceptor_failed); 'malformed_verdict' returns a \u00a75-invalid shape (transform decision with no body; exercises host_error:verdict_invalid). Mutually exclusive with 'return'."
        }
      },
      "oneOf": [
        {
          "required": [
            "return"
          ]
        },
        {
          "required": [
            "fault"
          ]
        }
      ]
    },
    "approval_rule": {
      "type": "object",
      "additionalProperties": false,
      "required": [
        "resolve"
      ],
      "properties": {
        "match": {
          "type": "object",
          "additionalProperties": true
        },
        "resolve": {
          "type": "object",
          "required": [],
          "properties": {
            "outcome": {
              "type": "string",
              "enum": [
                "approve",
                "reject",
                "unresolved"
              ]
            },
            "verdict": {
              "$ref": "https://agent-hooks.responsibleai.dev/v0.1/verdict.schema.json"
            },
            "fault": {
              "type": "string",
              "enum": [
                "raise"
              ],
              "description": "Fault injection (NOW-10): the scripted resolver raises/throws natively (exercises \u00a76.3/\u00a79 host_error:approval_resolver_failed). Mutually exclusive with 'outcome'."
            },
            "identity_override": {
              "type": "string",
              "description": "Return this context_identity instead of the one supplied in the ApprovalRequest (exercises \u00a79 host_error:approval_action_mismatch)."
            }
          },
          "oneOf": [
            {
              "required": [
                "outcome"
              ]
            },
            {
              "required": [
                "fault"
              ]
            }
          ]
        }
      }
    },
    "expect": {
      "type": "object",
      "additionalProperties": false,
      "required": [
        "interceptions",
        "run_outcome"
      ],
      "properties": {
        "interceptions": {
          "type": "array",
          "items": {
            "type": "object",
            "required": [
              "interception_point"
            ],
            "properties": {
              "interception_point": {
                "$ref": "https://agent-hooks.responsibleai.dev/v0.1/interception-point.schema.json"
              },
              "context": {
                "type": "object",
                "additionalProperties": true,
                "description": "Dotted-path -> expected-value assertions against the recorded AgentContext."
              },
              "context_must_validate": {
                "type": "boolean",
                "default": true
              }
            }
          }
        },
        "sequence_strict": {
          "type": "boolean",
          "default": true
        },
        "interceptions_absent": {
          "type": "array",
          "items": {
            "$ref": "https://agent-hooks.responsibleai.dev/v0.1/interception-point.schema.json"
          }
        },
        "tool_invocations": {
          "type": "array",
          "items": {
            "type": "object",
            "required": [
              "name",
              "args"
            ],
            "properties": {
              "name": {
                "type": "string"
              },
              "args": {
                "type": "object"
              }
            }
          }
        },
        "tool_not_invoked": {
          "type": "array",
          "items": {
            "type": "string"
          }
        },
        "final_output": true,
        "run_outcome": {
          "type": "string",
          "enum": [
            "completed",
            "blocked",
            "suspended",
            "error"
          ]
        },
        "identities_equal": {
          "type": "boolean",
          "description": "Assert input_identity == enforced_identity for all interception points (false to assert they differ at some interception point)."
        }
      }
    }
  },
  "oneOf": [
    {
      "required": [
        "interceptor_script"
      ]
    },
    {
      "required": [
        "interceptor_scripts"
      ]
    }
  ]
}